Title,Authors,Periodical-Title,Pub-Year,PMID
Preparing Learners for Future Experiences using Game-Based Learning,"Thompson, David; Bauman, Eric; Ranger, Nicole; Berry, Sue",Clinical Simulation In Nursing,2011,
Providing Culturally Sensitive and Linguistically Appropriate Services: An Insider Construct,"Peltier, S.",Canadian Journal Of Speech - Language Pathology And Audiology,2011,
"Rates of detection of mood and anxiety disorders in primary care: a descriptive, cross-sectional study","Vermani, Monica; Marcus, Madalyn; Katzman, Martin A.",The Primary Care Companion For CNS Disorders,2011,
Reactive oxygen and nitrogen species balance in the determination of thyroid hormones-induced cardiac hypertrophy mediated by renin-angiotensin system,"Araujo, A. S. R.; Diniz, G. P.; Seibel, F. E. R.; Branchini, G.; Ribeiro, M. F. M.; Brum, I. S.; Khaper, N.; Barreto-Chaves, M.; Bello-Klein, A.",Molecular And Cellular Endocrinology,2011,
Revisiting the Association Between Endometriosis and Bipolar Disorder,"Kumar, Vikaash; Khan, Mustaq; Vilos, George A.; Sharma, Verinder",Journal Of Obstetrics And Gynaecology Canada,2011,
"Serious Complications for Patients, Care Providers and Policy Makers: Tackling the Structural Violence of First Nations People Living with Diabetes in Canada","Maar, Marion A.; Manitowabi, Darrel; Gzik, Danusia; McGregor, Lorrilee; Corbiere, Cheri",International Indigenous Policy Journal,2011,
Sexual and Reproductive Health Counselling by Health Care Professionals,"Burnett, M.; Aggarwal, A.; Davis, V.; Dempster, J.; Fisher, W.; MacKinnon, K.; Pellizzari, R.; Polomeno, V.; Rutherford, M.; Senikas, V.; Wagner, M. S.; Ehman, W.; Biringer, A.; Gagnon, A.; Graves, L.; Hey, J.; Konkin, J.; Léger, F.; Marshall, C.; Leyland, N.; Wolfman, W.; Allaire, C.; Awadalla, A.; Best, C.; Dunn, S.; Heywood, M.; Lemyre, M.; Marcoux, V.; Menard, C.; Potestio, F.; Rittenberg, D.; Singh, S.; Social Sexual, Issues Comm; Family Physicians, Advisory Comm; Clinical Practice, Gynaecology Comm",Journal Of Obstetrics And Gynaecology Canada,2011,
STAKEHOLDER INPUT INTO A TOOL TO INVESTIGATE CAREGIVING ISSUES FROM THE PERSPECTIVE OF FAMILY PHYSICIANS,"Gibbons, C.; Bedard, M.; Lambert-Belanger, A.; Riendeau, J.",Gerontologist,2011,
Substance Use in Pregnancy,"Wong, Suzanne; Ordean, Alice; Kahan, Meldon; Gagnon, Robert; Hudon, Lynda; Basso, Melanie; Bos, Hayley; Crane, Joan; Davies, Gregory; Delisle, Marie-France; Farine, Dan; Menticoglou, Savas; Mundle, William; Murphy-Kaulbeck, Lynn; Ouellet, Annie; Pressey, Tracy; Roggensack, Anne; Sanderson, Frank; Ehman, William; Biringer, Anne; Gagnon, Andree; Graves, Lisa; Hey, Jonathan; Konkin, Jill; Leger, Francine; Marshall, Cindy; Robertson, Deborah; Bell, Douglas; Carson, George; Gilmour, Donna; Hughes, Owen; Le Jour, Caroline; Leduc, Dean; Leyland, Nicholas; Martyn, Paul; Masse, Andre; Abrahams, Ron; Avdic, Sanja; Berger, Howard; Franklyn, Mike; Harper, Samuel; Hunt, Georgia; Mousmanis, Patricia; Murphy, Kellie; Payne, Sarah; Midmer, Deana; de la Ronde, Sandra; Maternal Fetal, Med Comm; Family Physicians, Advisory Comm; Medico-Legal Comm",Journal Of Obstetrics And Gynaecology Canada,2011,
The occasional injection for trochanteric bursitis,"Kelly, Len; Minty, Lauren",Canadian Journal Of Rural Medicine,2011,
The prediction of the in-hospital mortality of acutely ill medical patients by electrocardiogram (ECG) dispersion mapping compared with established risk factors and predictive scores - A pilot study,"Kellett, John; Rasool, Shahzeb",European Journal Of Internal Medicine,2011,
The Presence of a Third Party During Breast and Pelvic Examinations,"Burnett, M.; Aggarwal, A.; Davis, V.; Dempster, J.; Fisher, W.; MacKinnon, K.; Pellizzari, R.; Polomeno, V.; Rutherford, M.; Wagner, M. S.; Ehman, W.; Biringer, A.; Gagnon, A.; Graves, L.; Hey, J.; Konkin, J.; Léger, F.; Marshall, C.; Leyland, N.; Wolfman, W.; Allaire, C.; Awadalla, A.; Best, C.; Dunn, S.; Heywood, M.; Lemyre, M.; Marcoux, V.; Ménard, C.; Potestio, F.; Rittenberg, D.; Singh, S.",Journal Of Obstetrics And Gynaecology Canada,2011,
The Primary Benefits of Angiotensin-Converting Enzyme Inhibition on Cardiac Remodeling Occur During Sleep Time in Murine Pressure Overload Hypertrophy,"Martino, Tami A.; Tata, Nazneen; Simpson, Jeremy A.; Vanderlaan, Rachel; Dawood, Fayez; Kabir, M. G.; Khaper, Neelam; Cifelli, Carlo; Podobed, Peter; Liu, Peter P.; Husain, Mansoor; Heximer, Scott; Backx, Peter H.; Sole, Michael J.",Journal Of The American College Of Cardiology,2011,
Transforming Child and Youth Mental Health Care via Innovative Technological Solutions,"Pepler, Antonio; Boydell, Katherine M.; Teshima, John; Volpe, Tiziana; Braunberger, Peter G.; Minden, Debbie",Healthcare Quarterly,2011,
"Twelve-week, randomized, multicenter study comparing a fixed combination of brimonidine-timolol with timolol as therapy adjunctive to latanoprost","Fechtner, Robert D.; Harasymowycz, Paul; Nixon, Donald R.; Vold, Steven D.; Zaman, Fiaz; Williams, Julia M.; Hollander, David A.",Clinical Ophthalmology,2011,
Ultrasonographic Cervical Length Assessment in Predicting Preterm Birth in Singleton Pregnancies,"Lim, Kenneth; Butt, Kimberly; Crane, Joan M.; Morin, Lucie; Bly, Stephen; Cargill, Yvonne; Davies, Gregory; Denis, Nanette; Ouellet, Annie; Salem, Shia; Senikas, Vyta; Ehman, William; Biringer, Anne; Gagnon, Andree; Graves, Lisa; Hey, Jonathan; Konkin, Jill; Leger, Francine; Marshall, Cindy; Gagnon, Robert; Hudon, Lynda; Basso, Melanie; Bos, Hayley; Delisle, Marie-France; Menticoglou, Savas; Mundle, William; Pressey, Tracy; Pylypjuk, Christy; Roggensack, Anne; Sanderson, Frank; Diagnostic, Imaging Comm; Family Physicians, Advisory Comm; Maternal Fetal, Med Comm",Journal Of Obstetrics And Gynaecology Canada,2011,
Who will be sicker in the morning? Changes in the Simple Clinical Score the day after admission and the subsequent outcomes of acutely ill unselected medical patients,"Kellett, John; Emmanuel, Andrew; Deane, Breda",European Journal Of Internal Medicine,2011,
A dynamic thermal model for heating microalgae incubator ponds using off-gas,"Shang, H.; Scott, J. A.; Shepherd, S. H.; Ross, G. M.",Chemical Engineering Science,2010,
"Achieving Cultural Integration in Health Services: Design of Comprehensive Hospital Model for Traditional Healing, Medicines, Foods and Supports","Walker, Roger; Cromarty, Helen; Linkewich, Barbara; Semple, Douglas; Pierre-Hansen, Natalie; Kelly, Len",International Journal Of Indigenous Health,2010,
Bone marrow derived cells decrease inflammation but not oxidative stress in an experimental model of acute myocardial infarction,"Vicente Tavares, Angela Maria; da Rosa Araujo, Alex Sander; Baldo, Guilherme; Matte, Ursula; Khaper, Neelam; Bello-Klein, Adriane; Rohde, Luis Eduardo; Clausell, Nadine",Life Sciences,2010,
"Cultural Missteps and Ethical Considerations with Indigenous Populations: Preliminary Reflections from Northeastern Ontario, Canada","Schinke, Robert J.; Enosse, Lawrence; Peltier, Duke; Watson, Jack; Lightfoot, Nancy",Journal Of Academic Ethics,2010,
Cystathionine gamma-lyase deficiency and overproliferation of smooth muscle cells,"Yang, Guangdong; Wu, Lingyun; Bryan, Sean; Khaper, Neelam; Mani, Sarathi; Wang, Rui",Cardiovascular Research,2010,
Design and synthesis of anti-breast cancer agents from 4-piperazinylquinoline: A hybrid pharmacophore approach,"Solomon, V. R.; Hu, Changkun; Lee, Hoyun",Bioorganic & Medicinal Chemistry,2010,
Effective teaching strategies and methods of delivery for patient education,"Friedman, Audrey Jusko; Boyko, Susan; Cosby, Roxanne",Journal of Cancer Education,2010,
Endometriosis: Diagnosis and Management,"Leyland, N.; Casper, R.; Laberge, P.; Singh, S. S.; Allen, L.; Arendas, K.; Allaire, C.; Awadalla, A.; Best, C.; Contestabile, E.; Dunn, S.; Heywood, M.; Leroux, N.; Potestio, F.; Rittenberg, D. A.; Soucy, R.; Wolfman, W. L.; Senikas, V.; Clinical Practice, Gynaecology Comm",Journal Of Obstetrics And Gynaecology Canada,2010,
How long does it take to perform emergency ultrasound for the primary indications?,"Socransky, S.; Wiss, R.; Bota, G.; Furtak, T.",Critical Ultrasound Journal,2010,
Increased resistance to hydrogen peroxide-induced cardiac contracture is associated with decreased myocardial oxidative stress in hypothyroid rats,"da Rosa Araujo, Alex Sander; Silva de Miranda, Madalena Freitas; de Oliveira, Ubirajara Oliveira; Fernandes, Tania; Llesuy, Susana; Rios Kucharski, Luiz Carlos; Khaper, Neelam; Bello-Klein, Adriane",Cell Biochemistry And Function,2010,
Oral direct factor Xa inhibition with edoxaban for thromboprophylaxis after elective total hip replacement,"Raskob, G.; Cohen, A. T.; Eriksson, B. I.; Puskas, D.; Shi, M. G.; Bocanegra, T.; Weitz, J. I.",Thrombosis And Haemostasis,2010,
Protective effects of polyphenolic compounds on oxidative stress-induced cytotoxicity in PC12 cells,"Crispo, James A. G.; Ansell, Dominique R.; Piche, Matthew; Eibl, Joseph K.; Khaper, Neelam; Ross, Gregory M.; Tai, T. C.",Canadian Journal Of Physiology And Pharmacology,2010,
Recurrent Urinary Tract Infection,"Epp, Annette; LarocheIle, Annick; Lovatsis, Danny; Walter, Jens -Erik; Easton, William; Farrell, Scott A.; Girouard, Lise; Gupta, Chander; Harvey, Marie-Andree; Robert, Magali; Ross, Sue; Schachter, Joyce; Schulz, Jane A.; Vkie, David; Ehman, William; Domb, Sharon; Gagnon, Andree; Hughes, Owen; Konkin, Jill; Lynch, Joanna; Marshall, Cindy; Comm, Urogynaecology; Family Physicians, Advisory Comm",Journal Of Obstetrics And Gynaecology Canada,2010,
Redox Regulation of Myocardial Erk 1/2 Phosphorylation in Experimental Hyperthyroidism: Role of Thioredoxin-Peroxiredoxin System,"da Rosa Araujo, Alex Sander; Fernandes, Tania; Ribeiro, Maria Flavia; Khaper, Neelam; Bello-Klein, Adriane",Journal Of Cardiovascular Pharmacology,2010,
Targeting the Vicious Inflammation-Oxidative Stress Cycle for the Management of Heart Failure,"Khaper, Neelam; Bryan, Sean; Dhingra, Sanjiv; Singal, Rohit; Bajaj, Anju; Pathak, Chander M.; Singal, Pawan K.",Antioxidants & Redox Signaling,2010,
Traditional Anishinabe Healing in a Clinical Setting: The Development of an Aboriginal Interdisciplinary Approach to Community-based Aboriginal Mental Health Care,"Maar, Marion A.; Shawande, Marjory",International Journal Of Indigenous Health,2010,
Aberrant adrenocortical tissue in hernia sac occurring in an adult: case report and review of the literature,"El Demellawy, D.; Nasr, A.; Samkari, A.; Pastolero, P.; Alowami, S.",Hernia,2009,
Community-based intervention to optimise falls risk management: a randomised controlled trial,"Ciaschini, P. M.; Straus, S. E.; Dolovich, L. R.; Goeree, R. A.; Leung, K. M.; Woods, C. R.; Zimmerman, G. M.; Majumdar, S. R.; Spadafora, S.; Fera, L. A.; Lee, H. N.",Age And Ageing,2009,
Cortical reorganization following anterior temporal lobectomy in patients with temporal lobe epilepsy,"Wong, S. W. H.; Jong, L.; Bandur, D.; Bihari, F.; Yen, Y-F; Takahashi, A. M.; Lee, D. H.; Steven, D. A.; Parrent, A. G.; Pigott, S. E.; Mirsattari, S. M.",Neurology,2009,
FOCUS GROUPS CONTRIBUTING TO DEVELOPMENT OF A SAFE DRIVING BEHAVIOR MEASURE,"Winter, S.; Classen, S.; Bedard, M.; Lutz, B. J.; Velozo, C. A.; Lanford, D. N.; Brumback, B.",Gerontologist,2009,
Fresh-frozen vs. irradiated allograft bone in orthopaedic reconstructive surgery,"Costain, D. J.; Crawford, R. W.",Injury - International Journal Of The Care Of The Injured,2009,
Harassment of Members of Parliament and the Legislative Assemblies in Canada by individuals believed to be mentally disordered,"Adams, Susan J.; Hazelwood, Tracey E.; Pitre, Nancy L.; Bedard, Terry E.; Landry, Suzette D.",Journal Of Forensic Psychiatry & Psychology,2009,
"Large differences in blood measures, tissue weights, and focal areas of damage 1 year after postseizure treatment with acepromazine or ketamine","George, Katherine R.; Rico, Timothy; St-Pierre, Linda; Dupont, Matthew J.; Blomme, Christopher G.; Mazzuchin, Angelo; Stewart, Lee S.; Persinger, Michael A.",Epilepsy & Behavior,2009,
Levels of Risk: Perspectives from the Lost Creek Fire,"Kulig, Judith C.; Edge, Dana; Reimer, William (Bill); Townshend, Ivan; Lightfoot, Nancy",Australian Journal Of Emergency Management,2009,
Management of kidney cancer: Canadian Kidney Cancer Forum Consensus Update,"Jewett, M. A. S.; Finelli, A.; Kollmannsberger, C.; Wood, L.; Legere, L.; Finelli, A.; Bjarnason, G.; Kapoor, A.; Karakiewicz, P.; Lacombe, L.; MacKenzie, M.; Rendon, R.; Tanguay, S.; Venner, P.; Wong, R.; Care, M.; Chin, J.; Clark, T.; Clarke, R.; Ebos, J.; Guba, M.; Hudson, T.; Kachura, J.; Kamel-Reid, S.; Kassouf, W.; Knox, J.; Leibovich, B.; Linehan, M.; Maskens, D.; O'Brien, P.; Pautler, S.; Reaume, N.; Rini, B.; Sills, T.; Quaggin, S.; Winquist, E.; Abugaber, A.; Assi, H.; Atwell, A.; Bajula, N.; Basiuk, J.; Black, P.; Blais, N.; Brigden, M.; Cagiannos, I.; Canil, C.; Carbonneau, F.; Chen, T.; Drachenberg, D.; Drayton, N.; Durrant, K.; Evans, A.; Fairfield, B.; Granl, R.; Heng, D.; Kawakami, J.; Klotz, L.; Kurban, G.; Kyryluk, K.; Link, I.; McAuley, I.; McCarthy, J.; Menard, G.; Michels, J.; Moore, R.; Morash, C.; North, S.; Pace, N.; Pause, A.; Pituskin, E.; Pizioli, T.; Reid, I.; Ruether, D.; Shaker, A.; Sridhar, K.; Taylor, L.; Truong, L. T.; Canadian Kidney Cancer, Forum 2009",CUAJ - Canadian Urological Association Journal,2009,
Molecular dynamics of histone H1,"Raghuram, Nikhil; Carrero, Gustavo; Th'ng, John; Hendzel, Michael J.",Biochemistry And Cell Biology,2009,
Novel Agent To Ablate CD8+ Cardiac Allograft Vasculopathy,"Jordan, J. L.; Ross, B. M.; Hirsch, G. M.; Lee, T. D. G.",Journal Of Heart And Lung Transplantation,2009,
Paint Your Plate: Effectiveness of a Point-of-purchase Display,"Colapinto, Cynthia K.; Malaviarachchi, Darshaka",Canadian Journal Of Dietetic Practice And Research,2009,
Paraquat-Induced Toxicity: Microarray Analysis of Gene Expression,"Mitsopoulos, P.; Cook, B.; Suntres, Z. E.",American Journal Of Respiratory And Critical Care Medicine,2009,
The patient journey record for complex care,"Martin, C.; Smith, K.; Ellaway, R.; Topps, D.; Biswas, R.; Sturmberg, J.",Swiss Medical Weekly,2009,
THE POSITIVE AND NEGATIVE APPRAISALS OF CAREGIVING ARE DIFFERENT CONSTRUCTS,"Vernon-Scott, S.; Bedard, M.",Gerontologist,2009,
Validation and Field Assessment of a Rapid Lateral Flow Assay for Detection of Bovine Antibody to Anaplasma marginale,"Nielsen, K.; Yu, W. L.; Kelly, L.; Williams, J.; Dajer, A.; Gutierrez, E.; Ramirez Cruz, G.; Renteria, T.; Bermudez, R.; Algire, J.",Journal Of Immunoassay & Immunochemistry,2009,
A 2-year community-randomized controlled trial of fluoride varnish to prevent early childnhood caries in Aboriginal children,"Lawrence, Herenia P.; Binguis, Darlene; Douglas, Jan; McKeown, Lynda; Switzer, Bonita; Figueiredo, Rafael; Laporte, Audrey",Community Dentistry And Oral Epidemiology,2008,
"Altered blood chemistry and hippocampal histomorphology in adult rats following prenatal exposure to physiologically-patterned, weak (50-500nanoTesla range) magnetic fields","St-Pierre, L.; Mazzuchin, A.; Persinger, M. A.",International Journal Of Radiation Biology,2008,
Community-based randomised controlled trial evaluating falls and osteoporosis risk management strategies,"Ciaschini, P. M.; Straus, S. E.; Dolovich, L. R.; Goeree, R. A.; Leung, K. M.; Woods, C. R.; Zimmerman, G. M.; Majumdar, S. R.; Spadafora, S.; Fera, L. A.; Lee, H. N.",Trials,2008,
Effects of a chronic exercise training protocol on oxidative stress and right ventricular hypertrophy in monocrotaline-treated rats,"Souza-Rabbo, Maristela; Silva, Luis F. F.; Auzani, Jorge A. S.; Picoral, Marcus; Khaper, Neelam; Belló-Klein, Adriane",Clinical And Experimental Pharmacology And Physiology,2008,
"Extended release quetiapine fumarate (quetiapine XR) monotherapy in long-term treatment of generalized anxiety disorder (GAD): Efficacy and tolerability results from a randomized, placebo-controlled trial","Katzman, Martin; Brawman-Mintzer, Olga; Reyes, Efren; Olausson, Bengt; Liu, Sherry; Brecher, Martin",Biological Psychiatry,2008,
Final report of a Canadian phase III trial of 3 vs 8 months Neoadjuvant androgen deprivation prior to 66 gray external beam radiotherapy for clinically localized prostate cancer,"Crook, J. M.; Ludgate, C.; Malone, S.; Eapen, L.; Perry, G.; Bowen, J.; Robertson, S.; Lockwood, G.",International Journal Of Radiation Oncology Biology Physics,2008,
"Liposomal Polymyxin B: Preparation, Characterization and Evaluation of its Activity towards Gram-negative Bacterial Strains","Alipour, M.; Omri, A.; Halwani, M.; Suntres, Z.",International journal of pharmaceutics,2008,
"Lys-110 is essential for targeting PCNA to replication and repair foci, and the K110A mutant activates apoptosis","Kim, Byung Ju; Lee, Hoyun",Biology of the Cell,2008,
Management of kidney cancer: Canadian kidney cancer forum consensus statement,"Jewett, M. A. S.; Knox, J. J.; Kollmonnsberger, C.; Basiuk, J.; Finelli, A.; Hotte, S.; Kapoor, A.; Karokiewicz, P.; Rendon, R.; Soulieres, D.; Tanguay, S.; Venner, P.; Wood, L.; Browman, G.; Clark, T.; Drachenberg, D.; Evans, A.; Gallie, B.; Haider, M.; Hudes, G.; MacKenzie, A.; Maskens, D.; Milosevic, M.; Negrier, S.; Pautler, S.; Reaume, N.; Wood, C.; Abugaber, A.; Andrew, S.; Assi, H.; Bagnell, S.; Bojula, N.; Bisson, B.; Bjarnasson, G.; Brigden, M.; Canil, C.; Chatters, D.; Chin, J.; Chin, S.; Clark, S.; French, C.; Gage, H.; Gianfelice, D.; Grant, R.; Gregg, R.; Guerra, O.; Hazenberg, I.; Kachura, J.; Mayhew, L.; North, S.; O'Brien, P.; Pituskin, E.; Reid, I.; Ross, D.; Ross, K.; Ruether, D.; Sridhar, K.; Stubbs, K.; Sturgeon, J.; Willacy, J.; Willacy, R.; Wong, R.; Zwonenburg, H.; Canadian Kidney Canc, Forum 2008",CUAJ - Canadian Urological Association Journal,2008,
MR Imaging-Compatible Electrode System for an Electroencephalography Epilepsy Monitoring Unit,"Mirsattari, S. M.; Tapsell, L. M.; Ives, J. R.; Lee, D. H.",American Journal Of Neuroradiology,2008,
One-way PCR-based mapping of a replication initiation point (RIP),"Romero, Julia; Lee, Hoyun",Nature Protocols,2008,
"p21(Cip1) expression is increased in ambient oxygen, compared to estimated physiological (5%) levels in rat muscle precursor cell culture","Lees, S. J.; Childs, T. E.; Booth, F. W.",Cell proliferation,2008,
Physiological weight loss in the breastfed neonate: a systematic review,"Noel-Weiss, Joy; Courant, Genevieve; Woodend, A. K.",Open Medicine,2008,
"Polymorphisms in manganese superoxide dismutase, myeloperoxidase and glutathione-S-transferase and survival after treatment for metastatic breast cancer","Bewick, Mary A.; Conlon, Michael S. C.; Lafrenie, Robert M.",Breast cancer research and treatment,2008,
"Reassessing the northern limit of maize consumption in North America: stable isotope, plant microfossil, and trace element content of carbonized food residue","Boyd, M.; Varney, T.; Surette, C.; Surette, J.",Journal Of Archaeological Science,2008,
Reduced physical activity and risk of chronic disease: the biology behind the consequences,"Booth, Frank W.; Laye, Matthew J.; Lees, Simon J.; Rector, R. Scott; Thyfault, John P.",European journal of applied physiology,2008,
Role of drug transporters and drug accumulation in the temporal acquisition of drug resistance,"Hembruff, Stacey L.; Laberge, Monique L.; Villeneuve, David J.; Guo, Baoqing; Veitch, Zachary; Cecchetto, Melanie; Parissenti, Amadeo M.",BMC cancer,2008,
Stability of methylnicotinate in aqueous solution as utilized in the 'niacin patch test',"Ross, Brian M.; Katzman, Martin",BMC Research Notes,2008,
Sub-parts per billion detection of trace volatile chemicals in human breath using selected ion flow tube mass spectrometry,"Ross, B. M.",BMC research notes,2008,
Synchronous renal cell carcinoma and adrenocortical carcinoma: a rare case report and clinicopathologic approach,"Jani, Prashant; Nasr, Ahmed Lotfy; El Demellawy, Dina",Canadian Journal Of Urology,2008,
Synthesis and cytotoxic activity of diosgenyl saponin analogues,"Kaskiw, M. J.; Tassotto, M. L.; Th'ng, J.; Jiang, Z. H.",Bioorganic & medicinal chemistry,2008,
Synthesis and in vitro cytotoxicity evaluation of 4-aminoquinoline derivatives,"Zhang, Haiwen; Solomon, V. Raja; Hu, Changkun; Ulibarri, Gerardo; Lee, Hoyun",Biomedicine & Pharmacotherapy,2008,
The efficacy and selectivity of tumor cell killing by Akt inhibitors are substantially increased by chloroquine,"Hu, Changkun; Solomon, V. Raja; Ulibarri, Gerardo; Lee, Hoyun",Bioorganic & medicinal chemistry,2008,
The role of redox signaling in cardiac hypertrophy induced by experimental hyperthyroidism,"Araujo, A. S. R.; Schenkel, P.; Enzveiler, A. T.; Fernandes, T. R. G.; Partata, W. A.; Llesuyl, S.; Ribeiro, M. F. M.; Khaper, N.; Singal, P. K.; Bello-Klein, A.",Journal Of Molecular Endocrinology,2008,
"Up-regulation of the proapoptotic caspase 2 splicing isoform by a candidate tumor suppressor, RBM5","Fushimi, K.; Ray, P.; Kar, A.; Wang, L.; Sutherland, L. C.; Wu, J. Y.",Proceedings of the National Academy of Sciences of the United States of America,2008,
Using the resident assessment instrument-mental health (RAI-MH) to determine levels of care for individuals with serious mental illness,"Gibbons, Carrie; Dubois, Sacha; Ross, Stephanie; Parker, Barbara; Morris, Kelly; Rn, Therese Lim; Bedard, Michel",Journal of behavioral health services & research,2008,
Venous but not skeletal muscle interstitial nitric oxide is increased during hypobaric hypoxia,"Leuenberger, Urs A.; Johnson, Douglas; Loomis, Joseph; Gray, Kristen S.; MacLean, David A.",European journal of applied physiology,2008,
What's mine is yours - open source as a new paradigm for sustainable healthcare education,"Ellaway, Rachel; Martin, Ross D.",Medical teacher,2008,
Zinc induces motor neuron death via a selective inhibition of brain-derived neurotrophic factor activity,"Post, J. I.; Eibl, J. K.; Ross, G. M.",Amyotrophic lateral sclerosis,2008,
Zinc-Fortified Foods Do Not Improve Intake of Total Dietary Zinc for Ontario Preschoolers,"Hennessy-Priest, Kathleen A.; Mustard, Jill L.; Keller, Heather H.; Rysdale, Lee A.; Beyers, Joanne E.; Goy, Richard; Simpson, Janis Randall",Journal of the American college of nutrition,2008,
"A flexible-dose, open-label trial evaluating the efficacy and safety of quetiapine (Seroquel®) as adjunctive pharmacotherapy for the treatment of Generalized Anxiety Disorder (GAD)","Katzman, M.; Vermani, M.; Jacobs, L.; Marcus, M.; Kong, B.; Lessard, S.; Galarraga, W.; Struzik, L.; Gendron, A.",Depression And Anxiety,2007,
Activation of apoptotic processes during transition from hypertrophy to heart failure in guinea pigs,"Sharma, A. K.; Dhingra, S.; Khaper, N.; Singal, P. K.",American Journal Of Physiology - Heart And Circulatory Physiology,2007,
An XML standard for virtual patients: exchanging case-based simulations in medical education,"Triola, M. M.; Campion, N.; McGee, J. B.; Albright, S.; Greene, P.; Smothers, V.; Ellaway, R.",AMIA Annual Symposium proceedings,2007,
Antioxidant modulation of oxidant-stimulated uptake and release of arachidonic acid in eicosapentaenoic acid-supplemented human lymphoma U937 cells,"Obajimi, Oluwakemi; Black, Kenneth D.; Glen, Iain; Ross, Brian M.",Prostaglandins Leukotrienes and Essential Fatty Acids,2007,
Bactericidal efficacy of liposomal aminoglycosides against Burkholderia cenocepacia,"Halwani, Majed; Mugabe, Clement; Azghani, Ali O.; Lafrenie, Robert M.; Kumar, Aseem; Omri, Abdelwahab",Journal of Antimicrobial Chemotherapy,2007,
Biomarkers of oxidative stress in schizophrenic and control subjects,"Young, J.; McKinney, S. B.; Ross, B. M.; Wahle, K. W. J.; Boyle, S. P.",Prostaglandins Leukotrienes and Essential Fatty Acids,2007,
Case 1: What a cheek!,"Johnston, Donna L.; Hatton, Jacqueline M.; Madden, Joseph; Briggs, Valerie; Chou, Shirley; Friedman, Jeremy",Paediatrics & Child Health,2007,
Changes in expression of cell wall turnover genes accompany inhibition of chromosome segregation by bovine protein kinase C alpha expression in Saccharomyces cerevisiae,"Sprowl, J. A.; Villeneuve, D. J.; Guo, B.; Young, A. J.; Hembruff, S. L.; Parissenti, A. M.",Cell biology international,2007,
Characterization of proliferating cell nuclear antigen (PCNA) isoforms in normal and cancer cells: There is no cancer-associated form of PCNA,"Naryzhny, Stanislav N.; Lee, Hoyun",FEBS letters,2007,
Considering the paraprofessional: one option for overcoming rural health human resource deficits,"Minore, J. B.; Boone, M.; Arthur, A.",Cahiers de sociologie et de demographie medicales,2007,
Cross-referencing the Scottish Doctor and Tomorrow's Doctors learning outcome frameworks,"Ellaway, Rachel; Evans, Phillip; Mckillop, Jim; Cameron, Helen; Morrison, Jill; Mckenzie, Hamish; Mires, Gary; Pippard, Martin; Simpson, John; Cumming, Allan; Harden, Ronald; Guild, Simon",Medical teacher,2007,
Cyclic AMP signaling contributes to neural plasticity and hyperexcitability in AH sensory neurons following intestinal Trichinella spiralis-induced inflammation,"Chen, Z.; Suntres, Z.; Palmer, J.; Guzman, J.; Javed, A.; Xue, J.; Yu, J. G.; Cooke, H.; Awad, H.; Hassanain, H. H.; Cardounel, A. J.; Christofi, F. L.",International journal for parasitology,2007,
Determination of the nu(e) and total B-8 solar neutrino fluxes using the Sudbury Neutrino Observatory Phase I data set,"Aharmim, B.; Ahmad, Q. R.; Ahmed, S. N.; Allen, R. C.; Andersen, T. C.; Anglin, J. D.; Buehler, G.; Barton, J. C.; Beier, E. W.; Bercovitch, M.; Bergevin, M.; Bigu, J.; Biller, S. D.; Black, R. A.; Blevis, I.; Boardman, R. J.; Boger, J.; Bonvin, E.; Boulay, M.",Physical Review C,2007,
Developing rural communities' capacity for palliative care: a conceptual model,"Kelley, M. L.",Journal of palliative care,2007,
