Title,Authors,Periodical-Title,Pub-Year,PMID
"Accelerated surgery versus standard care in hip fracture (HIP ATTACK): an international, randomised, controlled trial","Borges, Flavia K.; Bhandari, Mohit; Guerra-Farfan, Ernesto; Patel, Ameen; Sigamani, Alben; Umer, Masood; Tiboni, Maria E.; del Mar Villar-Casares, Maria; Tandon, Vikas; Tomas-Hernandez, Jordi; Teixidor-Serra, Jordi; Avram, Victoria R. A.; Winemaker, Mitchell; Ramokgopa, Mmampapatla T.; Szczeklik, Wojciech; Landoni, Giovanni; Wang, Chew Yin; Begum, Dilshad; Neary, John D.; Adili, Anthony; Sancheti, Parag K.; Lawendy, Abdel-Rahman; Balaguer-Castro, Mariano; Sleczka, Pawel; Jenkinson, Richard J.; Nur, Aamer Nabi; Wood, Gavin C. A.; Feibel, Robert J.; McMahon, Stephen J.; Sigamani, Alen; Popova, Ekaterine; Biccard, Bruce M.; Moppett, Iain K.; Forget, Patrice; Landais, Paul; McGillion, Michael H.; Vincent, Jessica; Balasubramanian, Kumar; Harvey, Valerie; Garcia-Sanchez, Yaiza; Pettit, Shirley M.; Gauthier, Leslie P.; Guyatt, Gordon H.; Conen, David; Garg, Amit X.; Bangdiwala, Shrikant I.; Belley-Cote, Emilie; Marcucci, Maura; Lamy, Andre; Whitlock, Richard; Le Manach, Yannick; Fergusson, Dean A.; Yusuf, Salim; Devereaux, P. J.; Veevaete, Laurent; de Waroux, Bernard, le Polain; Lavand'homme, Patricia; Cornu, Olivier; Tribak, Karim; Yombi, Jean Cyr; Touil, Nassim; Reul, Maike; Bhutia, Jigme Tshering; Clinckaert, Carol; De Clippeleir, Dirk; de Beer, Justin; Simpson, Diane L.; Worster, Andrew; Alvarado, Kim A.; Gregus, Krysten K.; Lawrence, Kelly H.; Leong, Darryl P.; Joseph, Philip G.; Magloire, Patrick; Deheshi, Benjamin; Bisland, Stuart; Wood, Thomas J.; Tushinski, Daniel M.; Wilson, David A. J.; Kearon, Clive; Cowan, David D.; Khanna, Vickas; Zaki, Amna; Farrell, Janet C.; MacDonald, Anne Marie; Wong, Steven C. W.; Karbassi, Arsha; Wright, Douglas Steven; Shanthanna, Harsha; Coughlin, Ryan; Khan, Moin; Wikkerink, Spencer; Quraishi, Faraaz A.; Kishta, Waleed; Schemitsch, Emil; Carey, Timothy; Macleod, Mark D.; Sanders, David W.; Vasarhelyi, Edward; Bartley, Debra; Dresser, George K.; Tieszer, Christina; Shadowitz, Steven; Lee, Jacques S.; Choi, Stephen; Kreder, Hans J.; Nousiainen, Markku; Kunz, Monica R.; Tuazon, Ravianne; Shrikumar, Mopina; Ravi, Bheeshma; Wasserstein, David; Stephen, David J. G.; Nam, Diane; Henry, Patrick D. G.; Mann, Stephen M.; Jaeger, Melanie T.; Sivilotti, Marco L. A.; Smith, Christopher A.; Frank, Christopher C.; Grant, Heather; Ploeg, Leone; Yach, Jeff D.; Harrison, Mark M.; Campbell, Aaron R.; Bicknell, Ryan T.; Bardana, Davide D.; McIlquham, Katie; Gallant, Catherine; Halman, Samantha; Thiruganasambandamoorth, Venkatesh; Ruggiero, Sara; Hadden, William J.; Chen, Brian P. -J; Coupal, Stephanie A.; McLean, Lisa M.; Shirali, Hemant R.; Haider, Syed Y.; Smith, Crystal A.; Watts, Evan; Santone, David J.; Koo, Kevin; Yee, Allan J.; Oyenubi, Ademilola N.; Nauth, Aaron; Schemitsch, Emil H.; Daniels, Timothy R.; Ward, Sarah E.; Hall, Jeremy A.; Ahn, Henry; Whelan, Daniel B.; Atrey, Amit; Khoshbin, Amir; Puskas, David; Droll, Kurt; Cullinan, Claude; Payendeh, Jubin; Lefrancois, Tina; Mozzon, Lise; Marion, Travis; Jacka, Michael J.; Greene, James; Menon, Matthew; Stiegelmahr, Robert; Dillane, Derek; Irwin, Marleen; Beaupre, Lauren; Coles, Chad P.; Trask, Kelly; MacDonald, Shelley; Trenholm, J. A.; Oxner, William; Richardson, C. G.; Dehghan, Niloofar; Sadoughi, Mehdi; Sharma, Achal; White, Neil J.; Olivieri, Loretta; Hunt, Stephen B.; Turgeon, Thomas R.; Bohm, Eric R.; Tran, Sarah; Giilck, Stephen M.; Hupel, Tom; Guy, Pierre; O'Brien, Peter J.; Duncan, Andrew W.; Crawford, Gordon A.; Zhou, Junlin; Zhao, Yanrui; Liu, Yang; Shan, Lei; Wu, Anshi; Munoz, Juan Manuel; Chaudier, Philippe; Douplat, Marion; Fessy, Michel Henri; Piriou, Vincent; Louboutin, Lucie; David, Jean Stephane; Friggeri, Arnaud; Beroud, Sebastien; Fayet, Jean Marie; Leung, Frankie Ka Li; Fang, Christian Xinshuo; Yee, Dennis King Hang; Sancheti, Parag Kantilal; Pradhan, Chetan Vijay; Patil, Atul Ashok; Puram, Chetan Prabhakar; Borate, Madhav Pandurang; Kudrimoti, Kiran Bhalchandra; Adhye, Bharati Anil; Dongre, Himanshu Vijaykumar; John, Bobby; Abraham, Valsamma; Pandey, Ritesh Arvind; Rajkumar, Arti; George, Preetha Elizabeth; Stephen, Manesh; Chandran, Nitheesh; Ashraf, Mohammed; Georgekutty, A. M.; Sulthan, Ahamad Shaheel; Adinarayanan, S.; Sharma, Deep; Barnawal, Satish Prasad; Swaminathan, Srinivasan; Bidkar, Prasanna Udupi; Mishra, Sandeep Kumar; Menon, Jagdish; Niranjan, M.; Zachariah, Varghese K.; Hiremath, Santosh Angad; Madhusudhan, N. C.; Jawali, Abhijit; Gnanadurai, Kingsly Robert; George, Carolin Elizabeth; Maddipati, Tatarao; Mary, K. P.; Sharma, Vijay; Farooque, Kamran; Malhotra, Rajesh; Mittal, Samarth; Sawhney, Chavi; Gupta, Babita; Mathur, Purva; Gamangati, Shivanand; Tripathy, Vijaylaxmi; Menon, Prem Haridas; Dhillon, Mandeep S.; Chouhan, Devendra K.; Patil, Sharanu; Narayan, Ravi; Lal, Purushotham; Bilchod, Prashanth Nabhirajappa; Singh, Surya Udai; Gattu, Uttam Vaidya; Dashputra, Ravi Prabhakar; Rahate, Prashant Vitthal; Turiel, Maurizio; De Blasio, Giuseppe; Accetta, Riccardo; Perazzo, Paolo; Stella, Daniele; Bonadies, Marika; Colombo, Chiara; Fozzato, Stefania; Pino, Fabio; Morelli, Ilaria; Colnaghi, Eleonora; Salini, Vincenzo; Denaro, Giuseppe; Beretta, Luigi; Placella, Giacomo; Giardina, Giuseppe; Binda, Mirko; Marcato, Anna; Guzzetti, Luca; Piccirillo, Fabio; Cecconi, Maurizio; Khor, H. M.; Lai, Hou Yee; Kumar, C. S.; Chee, K. H.; Loh, P. S.; Tan, Kit Mun; Singh, Simmrat; Foo, Li Lian; Prakasam, Komella; Chaw, Sook Hui; Lee, Meng-Li; Ngim, Joanne H. L.; Boon, Huck Wee; Chin, Im Im; Kleinlugtenbelt, Ydo V.; Landman, Ellie B. M.; Flikweert, Elvira R.; Roerdink, Herbert W.; Brokelman, Roy B. G.; Elskamp-Meijerman, Hannie; Horst, Maarten R.; Cobben, Jan-Hein M. G.; Anjum, Anila; Hashmi, Pervaiz Mehmood; Ahmed, Tashfeen; Rashid, Haroon Ur; Khattak, Mujahid Jamil; Rashid, Rizwan Haroon; Lakdawala, Riaz Hussain; Noordin, Shahryar; Juman, Naveed Muhammed; Khan, Robyna Irshad; Riaz, Muhammad Mehmood; Bokhari, Syedah Saira; Almas, Ayesha; Wahab, Hussain; Ali, Arif; Khan, Hammad Naqi; Khan, Eraj Khurshid; Janjua, Kholood Abid; Orakzai, Sajjad Hassan; Khan, Abdus Salam; Mustafa, Khawaja Junaid; Sohail, Mian Amjad; Umar, Muhammad; Khan, Siddra Ahmed; Ashraf, Muhammad; Khan, Muhammad Kashif; Shiraz, Muhammad; Furgan, Ahmad; Dabek, Piotr; Kumon, Adam; Satora, Wojciech; Ambrozy, Wojciech; Swiech, Mariusz; Rycombel, Jacek; Grzelak, Adrian; Gucwa, Jaroslaw; Machala, Waldemar; Ramokgopa, Mmampapatla Thomas; Firth, Gregory Bodley; Karera, Mwalimu; Fourtounas, Maria; Singh, Virsen; Biscardi, Anna; Iqbal, Muhammad Nasir; Campbell, Ryan Jonathan; Maluleke, Matimba Lenny; Moller, Carien; Nhlapo, Lerato; Maqungo, Sithombo; Flint, Margot; Nejthardt, Marcin B.; Chetty, Sean; Naidoo, Rubendren; Clua, Miriam Garrido; Molero-Garcia, Vicente; Minguell-Monyart, Joan; Marsa, Jordi Selga; Porcel-Vazquez, Juan; Andres-Peiro, Jose; Aguilar, Marc; Mestre-Torres, Jaume; Colomina, Maria J.; Guilabert, Patricia; Gozalo, M. L.; Abarca, Luis; Martin, Nuria; Usua, Gemma; Martinez-Ripol, Pedro; Posada, M. A. G.; Lalueza-Broto, Pilar; Sanchez-Raya, Judith; Camarena, Jorge Nunez; Fraguas-Castany, Antoni; Torner, Pere; Jornet-Gibert, Monsant; Serrano-Sanz, Jorge; Camara-Cabrera, Jaume; Salomo-Domenech, Monica; Yela-Verdu, Christian; Peig-Font, Anna; Ricol, Laura; Carreras-Castaner, Anna; Martinez-Sanudo, Luis; Herranz, Susana; Feijoo-Masso, Carlos; Sianes-Gallen, Monica; Castillon, Pablo; Bernaus, Marti; Quintas, Saioa; Gomez, Olga; Salvador, Jordi; Abarca, Javiera; Estrada, Cristina; Novellas, Marga; Torra, Merce; Dealbert, Alfred; Macho, Oscar; Ivanov, Alexia; Valldosera, Esther; Arroyo, Marta; Pey, Borja; Yuste, Antoni; Mateo, Llorenc; De Caso, Julio; Anaya, Rafael; Higa-Sansone, J.; Millan, Angelica; Banos, Victoria; Herrera-Mateo, Sergio; Aguado, Hector J.; Martinez-Municio, Gonzalo; Leon, Ricardo; Santiago-Maniega, Silvia; Zabalza, Ana; Labrador, Gregorio; Guerado, Enrique; Cruz, Encarnacion; Cano, Juan Ramon; Bogallo, Jose Manuel; Sa-Ngasoongsong, Paphon; Kulachote, Noratep; Sirisreetreerux, Norachart; Pengrung, Nachapan; Chalacheewa, Theerawat; Arnuntasupakul, Vanlapa; Yingchoncharoen, Teerapat; Naratreekoon, Bundit; Kadry, Miriam Adel; Thayaparan, Surendini; Abdlaziz, Ihab; Aframian, Arash; Imbuldeniya, Arjuna; Bentoumi, Souad; Omran, Sherif; Vizcaychipi, Marcela Paola; Correia, Patricia; Patil, Shashank; Haire, Kevin; Mayor, Amy S. E.; Dillingham, Sally; Nicholson, Laura; Elnaggar, Mohamed; John, Joby; Nanjayan, Shashi Kumar; Parker, Martyn J.; O'Sullivan, Susan; Marmor, Meir T.; Matityahu, Amir; McClellan, Robert Trigg; Comstock, Curt; Ding, Anthony; Toogood, Paul; Slobogean, Gerard; Joseph, Katherine; O'Toole, Robert; Sciadini, Marcus; Ryan, Scott P.; Clark, Molly E.; Cassidy, Charles; Balonov, Konstantin; Bergese, Sergio D.; Phieffer, Laura S.; Zacarias, Alicia A. Gonzalez; Marcantonio, Andrew J.; Dragic-Taylor, Sanela; Maxwell, Chelsea; Molnar, Sarah; Wells, Jennifer R.; Ofori, Sandra N.; Yang, Stephen S.; Wang, Michael K.; Duceppe, Emmanuelle; Spence, Jessica; Vasquez, Javiera P.; Marcano-Fernandez, Francesc; Ham, Hyungjoo; Prada, Carlos; Yung, Terence C. H.; Perez, Isidro Sanz; Bosch, Michael J.; Prystajecky, Michael R.; Chowdhury, Chinmoy; Khan, James S.; Stella, Steffan F.; Heidary, Behrouz; Tran, Allen; Wawrzycka-Adamczyk, Katarzyna; Chen, Yu Chiao Peter; Gonzalez-Osuna, Aranzazu; Biedron, Grzegorz; Wludarczyk, Anna; Lefebvre, Marco; Ernst, Jaclyn A.; Staffhorst, Bas; Woodfine, Jason D.; Alwafi, Emad M.; Mrkobrada, Marko; Parlow, Simon; Roberts, Robin; McAlister, Finlay; Sackett, David; Wright, James; HIP, ATTACK Investigators",Lancet,2020,
Air medical transport myths,"MacDonald, Russell D.; Lewell, Michael; Moore, Sean; Pan, Andy; Peddle, Michael; Sawadsky, Bruce",Canadian Journal Of Emergency Medicine,2020,
Applications of Two-Eyed Seeing in Primary Research Focused on Indigenous Health: A Scoping Review,"Forbes, Andrew; Ritchie, Stephen; Walker, Jennifer; Young, Nancy",International Journal Of Qualitative Methods,2020,
"Articulating the form, function, and meaning of drug using in the Philippines from the lens of morality and work ethics","Sy, Michael Palapal; Bontje, Peter; Ohshima, Nobuo; Kiepek, Niki",Journal Of Occupational Science,2020,
"Bacillus Calmette-Guerin vaccination and clinical characteristics and outcomes of COVID-19 in Rhode Island, United States: a cohort study","Weng, C-H; Saal, A.; Butt, W. W-W; Bica, N.; Fisher, J. Q.; Tao, J.; Chan, P. A.",Epidemiology And Infection,2020,
"Baseline staging imaging for distant metastasis in women with stages I, II, and III breast cancer","Arnaout, A.; Varela, N. P.; Allarakhia, M.; Grimard, L.; Hey, A.; Lau, J.; Thain, L.; Eisen, A.",Current Oncology,2020,
Canadian experience of neoadjuvant chemotherapy on bladder recurrences in patients managed with trimodal therapy for muscle-invasive bladder cancer,"Ajib, Khaled; Tjong, Michael C.; Tan, Guan Hee; Nason, Gregory; Berjaoui, Mohammad Baker; Erlich, Annette; Maganti, Manjula; Sridhar, Srikala; Fleshner, Neil E.; Zlotta, Alexandre R.; Catton, Charles; Berlin, Alejandro; Chung, Peter; Kulkarni, Girish S.",CUAJ - Canadian Urological Association Journal,2020,
Canadian Multicenter Project on Standardization of Programmed Death-Ligand 1 Immunohistochemistry 22C3 Laboratory-Developed Tests for Pembrolizumab Therapy in NSCLC,"Torlakovic, Emina; Albadine, Roula; Bigras, Gilbert; Boag, Alexander; Bojarski, Anna; Cabanero, Michael; Camilleri-Broet, Sophie; Cheung, Carol; Couture, Christian; Craddock, Kenneth J.; Cutz, Jean-Claude; Dhamanaskar, Prashant; Fiset, Pierre O.; Hossain, Mohammad; Hwang, David M.; Ionescu, Diana; Itani, Doha; Kelly, Margaret M.; Kwan, Keith; Lim, Hyun J.; Nielsen, Soren; Qing, Gefei; Sekhon, Harman; Spatz, Alan; Waghray, Ranjit; Wang, Hangjun; Xu, Zhaolin; Tsao, Ming Sound",Journal Of Thoracic Oncology,2020,
Combination Radiation Therapy and PARP Inhibition Enhances Responsiveness To Anti-PD-1 Therapy In Colorectal Tumor Models,"Seyedin, S. N.; Hasibuzzaman, M.; Pham, V.; Callaghan, C. M.; Kalen, A. L.; Mapuskar, K. A.; Mott, S.; Spitz, D. R., J.; Allen, B. G.; Caster, J. M.","International Journal Of Radiation Oncology, Biology, Physics",2020,
Comparison of characteristics of children and adolescents with and without a history of abuse assessed in an urgent psychiatric clinic,"Dolp, R.; Roberts, N.; Groll, D.",Paediatrics & Child Health,2020,
Comparison of coronary CT angiography versus functional imaging for CABG patients: A resource utilization analysis,"Small, Gary R.; Erthal, Fernanda; Alenazy, Ali; Yam, Yeung; Edwards, Michael; Crean, Andrew; Beanlands, Rob S.; Ruddy, Terrence D.; Chow, Benjamin J. W.",IJC Heart & Vasculature,2020,
Decision-Based Cooperative Spectrum Sensing Using Random Medium-Access Sequential Reporting,"Ahmed, Ahmed A.; Abu Alkheir, Ala; Mouftah, Hussein T.",Canadian Journal Of Electrical And Computer Engineering - Revue Canadienne De Genie Electrique Et Informatique,2020,
Determining Early Remodeling Patterns in Diabetes and Hypertension Using Cardiac Computed Tomography: The Feasibility of Assessing Early LV Geometric Changes,"Walpot, Jeroen; Inacio, Joao R.; Massalha, Samia; Hossain, Alomgir; Small, Gary R.; Crean, Andrew M.; Yam, Yeung; Rybicki, Frank; Dwivedi, Girish; Chow, Benjamin J. W.",American Journal Of Hypertension,2020,
Efficacy of tildrakizumab by patient demographic and disease characteristics across a phase 2b and 2 phase 3 trials in patients with moderate-to-severe chronic plaque psoriasis,"Poulin, Y.; Ramon, M.; Rosoph, L.; Weisman, J.; Mendelsohn, A. M.; Parno, J.; Rozzo, S. J.; Lee, P.",Journal Of The European Academy Of Dermatology And Venereology,2020,
Endovascular Cerebral Venous Sinus Imaging with Optical Coherence Tomography,"Pasarikovski, C. R.; Ku, J. C.; Keith, J.; Ramjist, J.; Dobashi, Y.; Priola, S. M.; da Costa, L.; Yang, VXD",American Journal Of Neuroradiology,2020,
Engagement with Manage My Pain mobile health application among patients at the Transitional Pain Service,"Slepian, P. M.; Peng, Michael; Janmohamed, Tahir; Kotteeswaran, Yuvaraj; Manoo, Varuna; Blades, Alexander McLaren; Fiorellino, Joseph; Katznelson, Rita; Tamir, Diana; McRae, Karen; Kahn, Michael; Huang, Alexander; Kona, Sharath; Thaker, Sonalben; Weinrib, Aliza; Katz, Joel; Clarke, Hance",Digital Health,2020,
Estimated susceptibility of Canadian meningococcal B isolates to a meningococcal serogroup B vaccine (MenB-FHbp),"Bettinger, Julie A.; Liberator, Paul; Halperin, Scott A.; Vaudry, Wendy; Sadarangani, Manish; Hao, Li; Lambert, Nathaniel; Jansen, Kathrin U.; Anderson, Annaliesa S.; Tsang, Raymond",Vaccine,2020,
First Nations' Survivance and Sovereignty in Canada during a Time of COVID-19,"Rowe, Robyn K.; Rowat, Julia; Walker, Jennifer D.",American Indian Culture And Research Journal,2020,
Impact of trainee involvement on patient radiation exposure and contrast volumes during invasive cardiac procedures,"Kansal, Vinay; Simard, Trevor; Di Santo, Pietro; Chong, Aun Yeong; So, Derek; Hossain, Alomgir; Small, Gary; Chow, Benjamin J. W.; Hibbert, Benjamin",Clinical And Investigative Medicine,2020,
"Major Outcomes With Personalized Dialysate TEMPerature (MyTEMP): Rationale and Design of a Pragmatic, Registry-Based, Cluster Randomized Controlled Trial","Al-Jaishi, A. A.; McIntyre, C. W.; Sontrop, J. M.; Dixon, S. N.; Anderson, S.; Bagga, A.; Benjamin, D.; Berry, D.; Blake, P. G.; Chambers, L.; Chan, PCK; Delbrouck, N.; Devereaux, P. J.; Ferreira-Divino, L. F.; Goluch, R.; Gregor, L.; Grimshaw, J. M.; Hanson, G.; Iliescu, E.; Jain, A. K.; Lok, C. E.; Mustafa, R. A.; Nathoo, B.; Nesrallah, G. E.; Oliver, M. J.; Pandeya, S.; Parmar, M. S.; Perkins, D.; Presseau, J.; Rabin, E.; Sasal, J.; Shulman, T.; Sood, M. M.; Steele, A.; Tam, P.; Tascona, D.; Wadehra, D.; Wald, R.; Walsh, M.; Watson, P.; Wodchis, W.; Zager, P.; Zwarenstein, M.; Garg, A. X.; Investigators, Mytemp",Canadian Journal Of Kidney Health And Disease,2020,
Meta-analysis of nursing-related organizational and psychosocial predictors of sickness absence,"Gohar, B.; Lariviere, M.; Lightfoot, N.; Wenghofer, E.; Lariviere, C.; Nowrouzi-Kia, B.",Occupational Medicine,2020,
Methamphetamine use among gay men: An interpretive review of a non-sanctioned occupation,"Gish, Alexander; Kiepek, Niki; Beagan, Brenda",Journal Of Occupational Science,2020,
Mining-Related Lower Back Injuries and the Compensation Process: An Injured Worker's Journey,"Mongeau, Sherry; Lightfoot, Nancy; MacEwan, Leigh; Eger, Tammy",Workplace Health & Safety,2020,
Non-lesional eating epilepsy with temporo-insular onset: A stereo-EEG study,"Aldosari, Mubarak M.; Joswig, Holger; Marti, Ana Suller; Parrent, Andrew; Mirsattari, Seyed M.",Epilepsy & Behavior Reports,2020,
Patient and physician perceptions of lung cancer care in a multidisciplinary clinic model,"Linford, G.; Egan, R.; Coderre-Ball, A.; Dalgarno, N.; Stone, CJL; Robinson, A.; Robinson, D.; Wakeham, S.; Digby, G. C.",Current Oncology,2020,
Pharmacogenetic Testing Options Relevant to Psychiatry in Canada: Options de tests pharmacogenetiques pertinents en psychiatrie au Canada,"Maruf, Abdullah Al; Fan, Mikayla; Arnold, Paul D.; Muller, Daniel J.; Aitchison, Katherine J.; Bousman, Chad A.",Canadian Journal Of Psychiatry.Revue Canadienne De Psychiatrie,2020,
Reference values for mid -diastolic right ventricular volume in population referred for cardiac computed tomography: An additional diagnostic value to cardiac computed tomography,"Massalha, Samia; Almufleh, Aws; Walpot, Jeroen; Ratnayake, Indeevari; Qureshi, Rohail; Abbass, Tasneem; Pena, Elena; Inacio, Joao; Rybicki, Frank J.; Small, Gary; Crean, Andrew; Chow, Benjamin J. W.",Journal Of Cardiovascular Computed Tomography,2020,
Role of Cardiac Auscultation in the Era of Portable Handheld Ultrasound,"Le, Vincent Kent; Beruar, Ananya; Liu, Helen; Sadreddini, Masoud; Salehian, Omid",Canadian Journal Of Cardiology,2020,
Successful treatment of locally advanced urachal adenocarcinoma with peri-operative gemcitabine - cisplatin combination therapy: a case report and perspective on targeted therapies,"Voutsadakis, Ioannis A.",Central European Journal Of Urology,2020,
"The implementation of rifapentine and isoniazid (3HP) in two remote Arctic communities with a predominantly Inuit population, the Taima TB 3HP study","Alvarez, G. G.; Van Dyk, D.; Mallick, R.; Lesperance, S.; Demaio, P.; Finn, S.; Potvin, S. E.; Patterson, M.; Pease, C.; Amaratunga, K.; Hui, C.; Cameron, D. W.; Mulpuru, S.; Aaron, S. D.; Momoli, F.; Zwerling, A.",International Journal Of Circumpolar Health,2020,
The role of cardiac imaging in the management of non-ischemic cardiovascular diseases in human immunodeficiency virus infection,"Aljizeeri, Ahmed; Small, Gary; Malhotra, Saurabh; Buechel, Ronny; Jain, Diwakar; Dwivedi, Girish; Al-Mallah, Mouaz",Journal Of Nuclear Cardiology,2020,
The role of the epilepsy monitoring unit in the investigation of patients with epilepsy and intellectual disabilities,"Marti, A. S.; Aldosari, M.; Mirsattari, S. M.",Epilepsy & Behavior,2020,
Utility of digital rectal examination in a population with prostate cancer treated with active surveillance,"Herrera-Caceres, Jaime; Wettstein, Marian S.; Goldberg, Hanan; Toi, Ants; Chandrasekar, Thenappan; Woon, Dixon T. S.; Ahmad, Ardalan E.; Sanmamed-Salgado, Noelia; Alhunaidi, Omar; Ajib, Khaled; Nason, Gregory; Tan, Guan Hee; Fleshner, Neil; Klotz, Laurence",CUAJ - Canadian Urological Association Journal,2020,
"Working Toward Healthcare Integration: A Broad-Based Community Effort in Muskoka, Ontario","Mathies, David J.",Healthcarepapers,2020,
A Latent Class Analysis of the Social Determinants of Health Impacting Heavy Alcohol Consumption Among Women Living with HIV in Canada: The Canadian HIV Women's Sexual and Reproductive Health Cohort Study,"Shokoohi, Mostafa; Bauer, Greta R.; Kaida, Angela; Logie, Carmen H.; Carter, Allison; Lacombe-Duncan, Ashley; Loutfy, Mona; Abdul-Noor, Rahma; Anema, Aranka; Angel, Jonathan; Baril, Jean-Guy; Barry, Fatimatou; Beaver, Kerrigan; Becker, Denise; Benoit, Anita; Brophy, Jason; Brotto, Lori; Burchell, Ann; Cardinal, Claudette; Carlson, Allison; Cescon, Angela; Cioppa, Lynne; Cohen, Jeffrey; Colley, Guillaume; Conway, Tracey; Cooper, Curtis; Cotnam, Jasmine; Cousineau, Janette; Dayle, Janice; Desbiens, Marisol; Dubinsky, Hania; Dubuc, Daniele; Duddy, Janice; Gagnier, Brenda; Gahagan, Jacqueline; Gasingirwa, Claudine; Gataric, Nada; Greene, Saara; Hart, Trevor; Hankins, Catherine; Hogg, Bob; Howard, Terry; Islam, Shazia; Jones, Evin; Kaushic, Charu; Keating, Alexandria; Kennedy, Logan; Kestler, Mary; Kiboyogo, Maxime; Klein, Marina; Kwaramba, Gladys; Langlois, Andrea; Lee, Melanie; Lee, Rebecca; Leonard, Lynne; Lewis, Johanna; Lima, Viviane; Lloyd-Smith, Elisa; Logie, Carmen; Margolese, Shari; Martin, Carrie; Masching, Renee; Massie, Lyne; Medjuck, Melissa; Menard, Brigitte; Miller, Cari; Money, Deborah; Muchenje, Marvelous; Mwalwanda, Mary; Ndungu, Mary (Nuthoni); Nicholson, Valerie; Nzikwikiza, Illuminee; O'Brien, Kelly; O'Brien, Nadia; Ogilvie, Gina; Ogunnaike-Cooke, Susanna; Otis, Joanne; Palmer, Ali; Patterson, Sophie; Peltier, Doris; Persad, Yasmeen (Ashria); Pick, Neora; Pierre, Alie; Powis, Jeff; Proulx-Boucher, Karene; Quan, Corinna; Raboud, Janet; Rachlis, Anita; Ralph, Edward; Rawson, Stephanie; Roth, Eric; Rouleau, Danielle; Rourke, Sean; Rueda, Sergio; Saavedra, Mercy; Salters, Kate; Sanchez, Margarite; Sandre, Roger; Sas, Jacquie; Sereda, Paul; Smaill, Fiona; Smith, Stephanie; Summers, Marcie; Tigere, Tsitsi; Tharao, Wangari; Thomas-Pavanel, Jamie; Tom, Christina; Tremblay, Cecile; Trottier, Benoit; Trottier, Sylvie; Tsoukas, Christos; Wagner, Anne; Walmsley, Sharon; Webster, Kath; Wobeser, Wendy; Yee, Jessica; Yudin, Mark; Zhang, Wendy; CHIWOS, Res Team",AIDs And Behavior,2019,
"A longitudinal study of associations between HIV-related stigma, recent violence and depression among women living with HIV in a Canadian cohort study","Logie, Carmen H.; Marcus, Natania; Wang, Ying; Kaida, Angela; O'Campo, Patricia; Ahmed, Uzma; O'Brien, Nadia; Nicholson, Valerie; Conway, Tracey; de Pokomandy, Alexandra; Fernet, Mylene; Loutfy, Mona; Anema, Aranka; Becker, Denise; Brotto, Lori; Carter, Allison; Cardinal, Claudette; Colley, Guillaume; Ding, Erin; Duddy, Janice; Gataric, Nada; Hogg, Robert S.; Howard, Terry; Jabbari, Shahab; Jones, Evin; Kestler, Mary; Langlois, Andrea; Lima, Viviane; Lloyd-Smith, Elisa; Medjuck, Melissa; Miller, Cari; Money, Deborah; Ogilvie, Gina; Patterson, Sophie; Pick, Neora; Roth, Eric; Salters, Kate; Sanchez, Margarite; Sas, Jacquie; Sereda, Paul; Summers, Marcie; Tom, Christina; Wang, Lu; Webster, Kath; Zhang, Wendy; Angel, Jonathan; Barry, Fatimatou; Bauer, Greta; Beaver, Kerrigan; Benoit, Anita; Bertozzi, Breklyn; Borton, Sheila; Bourque, Tammy; Brophy, Jason; Burchell, Ann; Carlson, Allison; Cioppa, Lynne; Cohen, Jeffrey; Cooper, Curtis; Cotnam, Jasmine; Cousineau, Janette; Fraleigh, Annette; Gagnier, Brenda; Gasingirwa, Claudine; Greene, Saara; Hart, Trevor; Islam, Shazia; Kaushic, Charu; Kennedy, Logan; Kerr, Desiree; Kiboyogo, Maxime; Kwaramba, Gladys; Leonard, Lynne; Lewis, Johanna; Logie, Carmen; Margolese, Shari; Muchenje, Marvelous; Mary; Ndung'u; O'Brien, Kelly; Ouellette, Charlene; Powis, Jeff; Quan, Corinna; Raboud, Janet; Rachlis, Anita; Ralph, Edward; Rourke, Sean; Rueda, Sergio; Sandre, Roger; Smaill, Fiona; Smith, Stephanie; Tigere, Tsitsi; Tharao, Wangari; Walmsley, Sharon; Wobeser, Wendy; Yee, Jessica; Yudin, Mark; Baril, Jean-Guy; Burke, Nora Butler; Clement, Pierrette; Dayle, Janice; Dubuc, Daniele; Groleau, Danielle; Hot, Aurelie; Klein, Marina; Martin, Carrie; Massie, Lyne; Menard, Brigitte; Otis, Joanne; Peltier, Doris; Pierre, Alie; Proulx-Boucher, Karene; Rouleau, Danielle; Savoie, Edenia; Iremblay, Cecile; Trottier, Benoit; Trottier, Sylvie; Tsoukas, Christos; Gahagan, Jacqueline; Hankins, Catherine; Masching, Renee; Ogunnaike-Cooke, Susanna; CHIWOS, Res Team",Journal Of The International AIDS Society,2019,
Bilateral and Unilateral Partially Thrombosed Orbital Varices Report of Two Cases and Literature Review,"Shahi, Niharika, ; Kisselgoff, David, ; Shuster, Anatoly, ",SN Compr.Clin.Med.SN Comprehensive Clinical Medicine,2019,
Childbirth and prevention of bipolar disorder: an opportunity for change,"Sharma, Verinder; Bergink, Veerle; Berk, Michael; Chandra, Prabha S.; Munk-Olsen, Trine; Viguera, Adele C.; Yatham, Lakshmi N.",Lancet Psychiatry,2019,
Chlorhexidine skin symptoms and allergy in dialysis patients and nurses,"Chan, F. L.; Merchant, A. A.; Breede, N.; Lipszyc, J. C.; House, R.; Tarlo, S. M.",Clinical And Experimental Allergy,2019,
Community engagement in general practice: a qualitative study,"Rowe, N.; Keenan, R.; Lack, L.; Malloy, N.; Strasser, R.; Lawrenson, R.",Journal Of Primary Health Care,2019,
Comparison of Framingham risk score and chest-CT identified coronary artery calcification in breast cancer patients to predict cardiovascular events,"Phillips, William J.; Johnson, Christopher; Law, Angeline; Turek, Michele; Small, Alex R.; Dent, Susan; Ruddy, Terrence D.; Beanlands, Rob S.; Chowb, Benjamin J. W.; Small, Gary R.",International Journal Of Cardiology,2019,
Competency-Based Medical Education Do the Cardiac Imaging Training Guidelines Have it Right?,"Chow, Benjamin J. W.; Alenazy, Ali; Small, Gary; Crean, Andrew; Yam, Yeung; Beanlands, Rob S.; Clarkin, Owen; Froeschl, Michael; Ruddy, Terrence D.; Hossain, Alomgir",JACC - Cardiovascular Imaging,2019,
"Depression, Antidepressants and Hypertensive Disorders of Pregnancy: A Systematic Review","Youash, Sabrina; Sharma, Verinder",Current Drug Safety,2019,
