Title,Authors,Periodical-Title,Pub-Year,PMID
Role of sleep deprivation in the causation of postpartum obsessive-compulsive disorder,"Sharma, Verinder",Medical Hypotheses,2019,
Seeking legitimacy for broad understandings of substance use,"Kiepek, Niki; Van de Ven, Katinka; Dunn, Matthew; Forlini, Cynthia",International Journal Of Drug Policy,2019,
Severe illness getting noticed sooner - SIGNS-for-Kids: developing an illness recognition tool to connect home and hospital,"Gilleland, Jonathan; Bayfield, David; Bayliss, Ann; Dryden-Palmer, Karen; Fawcett-Arsenault, Joelle; Gordon, Michelle; Hartfield, Dawn; Iacolucci, Anthony; Jones, Melissa; Ladouceur, Lisa; McNamara, Martin; Middaugh, Kristen; Moore, Gregory; Murray, Sean; Noble, Joanna; Singh, Simran; Stuart-Minaret, Jane; Williams, Carla; Parshuram, Christopher S.",BMJ Open Quality,2019,
"Silences around occupations framed as unhealthy, illegal, and deviant","Kiepek, Niki C.; Beagan, Brenda; Rudman, Debbie Laliberte; Phelan, Shanon",Journal Of Occupational Science,2019,
Social determinants of health and self-rated health status: A comparison between women with HIV and women without HIV from the general population in Canada,"Shokoohi, Mostafa; Bauer, Greta R.; Kaida, Angela; Lacombe-Duncan, Ashley; Kazemi, Mina; Gagnier, Brenda; de Pokomandy, Alexandra; Loutfy, Mona; Abdul-Noor, Rahma; Anema, Aranka; Angel, Jonathan; Baril, Jean-Guy; Barry, Fatimatou; Bauer, Greta; Beaver, Kerrigan; Becker, Denise; Benoit, Anita; Brophy, Jason; Brotto, Lori; Burchell, Ann; Cardinal, Claudette; Carlson, Allison; Carter, Allison; Cescon, Angela; Cioppa, Lynne; Cohen, Jeffrey; Colley, Guillaume; Conway, Tracey; Cooper, Curtis; Cotnam, Jasmine; Cousineau, Janette; Dayle, Janice; Desbiens, Marisol; Dubinsky, Hania; Dubuc, Daniele; Duddy, Janice; Gahagan, Jacqueline; Gasingirwa, Claudine; Gataric, Nada; Greene, Saara; Hart, Trevor; Hankins, Catherine; Hogg, Bob; Howard, Terry; Islam, Shazia; Jones, Evin; Kaushic, Charu; Keating, Alexandria; Kennedy, Logan; Kestler, Mary; Kiboyogo, Maxime; Klein, Marina; Kwaramba, Gladys; Langlois, Andrea; Lee, Melanie; Lee, Rebecca; Leonard, Lynne; Lewis, Johanna; Lima, Viviane; Lloyd-Smith, Elisa; Logie, Carmen; Margolese, Shari; Martin, Carrie; Masching, Renee; Massie, Lyne; Medjuck, Melissa; Menard, Brigitte; Miller, Cari; Money, Deborah; Muchenje, Marvelous; Mwalwanda, Mary; Ndungu, Mary (Muthoni); Nicholson, Valerie; Nzikwikiza, Illuminee; O'Brien, Kelly; O'Brien, Nadia; Ogilvie, Gina; Ogunnaike-Cooke, Susanna; Otis, Joanne; Palmer, Ali; Patterson, Sophie; Peltier, Doris; Persad, Yasmeen (Ashria); Pick, Neora; Pierre, Alie; Powis, Jeff; Proulx-Boucher, Karene; Quan, Corinna; Raboud, Janet; Rachlis, Anita; Ralph, Edward; Rawson, Stephanie; Roth, Eric; Rouleau, Danielle; Rourke, Sean; Rueda, Sergio; Saavedra, Mercy; Salters, Kate; Sanchez, Margarite; Sandre, Roger; Sas, Jacquie; Sereda, Paul; Smaill, Fiona; Smith, Stephanie; Summers, Marcie; Tigere, Tsitsi; Tharao, Wangari; Thomas-Pavanel, Jamie; Tom, Christina; Tremblay, Cecile; Trottier, Benoit; Trottier, Sylvie; Tsoukas, Christos; Wagner, Anne; Walmsley, Sharon; Webster, Kath; Wobeser, Wendy; Yee, Jessica; Yudin, Mark; Zhang, Wendy; CHIWOS, Res Team",PLOS One,2019,
Substance use to enhance occupational performance and experience: a critical interpretive synthesis,"Kiepek, Niki; Beagan, Brenda; Phelan, Shanon",Cadernos Brasileiros De Terapia Ocupacional - Brazilian Journal Of Occupational Therapy,2019,
Theory of Nurse Practitioner Job Satisfaction,"Fournier, Jennifer; Lightfoot, Nancy; Larocque, Sylvie; Johnson, Jennifer; Eger, Tammy",JNP - Journal For Nurse Practitioners,2019,
Treatment of trichotillomania and subthreshold bipolar disorder with lithium,"Sharma, Verinder",Bipolar Disorders,2019,
Use of substances among professionals and students of professional programs: a review of the literature,"Kiepek, Niki; Baron, Jonnie-Lyn",Drugs - Education Prevention And Policy,2019,
Variation in hepatitis C virus treatment uptake between Canadian centres in the era of direct-acting antivirals,"Nitulescu, Roy; Young, Jim; Saeed, Sahar; Cooper, Curtis; Cox, Joseph; Martel-Laferriere, Valerie; Hull, Mark; Walmsley, Sharon; Tyndall, Mark; Wong, Alexander; Klein, Marina B.; Barrett, Lisa; Cohen, Jeff; Conway, Brian; Cote, Pierre; Gill, John; Haider, Shariq; Montaner, Julio; Pick, Neora; Rachlis, Anita; Rouleau, Danielle; Sandre, Roger; Sadr, Aida; Sanche, Steve; Canadian Co-Infection, Cohort Study",International Journal Of Drug Policy,2019,
Who cares? The impact on caregivers of suspected mining-related lung cancer,"Lightfoot, N.; MacEwan, L.; Tufford, L.; Holness, D. L.; Mayer, C.; Kramer, D. M.",Current Oncology,2019,
A 4-Week Model of House Dust Mite (HDM) Induced Allergic Airways Inflammation with Airway Remodeling,"Woo, L. N.; Guo, W. Y.; Wang, X.; Young, A.; Salehi, S.; Hin, A.; Zhang, Y.; Scott, J. A.; Chow, C. W.",Scientific Reports,2018,
Are there increased periprocedural complications with the MRI-conditional Medtronic Revo SureScan Pacing System?,"Shurrab, M.; Kaoutskaia, A.; Baranchuk, A.; Lau, C.; Singarajah, T.; Lashevsky, I.; Newman, D.; Healey, J. S.; Crystal, E.",Netherlands Heart Journal,2018,
"Considering axiological integrity: a methodological analysis of qualitative evidence syntheses, and its implications for health professions education","Kelly, Martina; Ellaway, Rachel H.; Reid, Helen; Ganshorn, Heather; Yardley, Sarah; Bennett, Deirdre; Dornan, Tim",Advances In Health Sciences Education,2018,
Coronary CTA for Preoperative Risk Assessment in Noncardiac Surgery,"Small, Gary R.; Ernst, Jaclyn; Gauthier, Nadine; Chow, Benjamin J. W.",Current Cardiovascular Imaging Reports,2018,
Distributed medical education in Canada,"Ellaway, Rachel; Bates, Joanna",Canadian Medical Education Journal,2018,
Disulfiram causes selective hypoxic cancer cell toxicity and radio-chemo-sensitization via redox cycling of copper,"Hubert, Kelly; Butler, Aimee; Gui, Kai; Anderson, Michael; Stolwijk, Jeffrey; Gibson, Adrienne; Rodman, Samuel; Heer, Collin; Solst, Shane; Fath, Melissa; McCormick, Michael; Spitz, Doug",Free Radical Biology And Medicine,2018,
Exploring social ecological pathways from resilience to quality of life among women living with HIV in Canada,"Logie, Carmen H.; Wang, Ying; Kazemi, Mina; Hawa, Roula; Kaida, Angela; Conway, Tracey; Webster, Kath; de Pokomandy, Alexandra; Loutfy, Mona; Abdul-Noor, Rahma; Anema, Aranka; Angel, Jonathan; Baril, Jean-Guy; Barry, Fatimatou; Bauer, Greta; Beaver, Kerrigan; Becker, Denise; Benoit, Anita; Brophy, Jason; Brotto, Lori; Burchell, Ann; Cardinal, Claudette; Carlson, Allison; Carter, Allison; Cescon, Angela; Cioppa, Lynne; Cohen, Jeffrey; Colley, Guillaume; Cooper, Curtis; Cotnam, Jasmine; Cousineau, Janette; Dayle, Janice; Desbiens, Marisol; Dubinsky, Hania; Dubuc, Daniele; Duddy, Janice; Gagnier, Brenda; Gahagan, Jacqueline; Gasingirwa, Claudine; Gataric, Nada; Greene, Saara; Hart, Trevor; Hankins, Catherine; Hogg, Bob; Howard, Terry; Islam, Shazia; Jones, Evin; Kaushic, Charu; Keating, Alexandria; Kennedy, Logan; Kestler, Mary; Kiboyogo, Maxime; Klein, Marina; Kwaramba, Gladys; Langlois, Andrea; Lee, Melanie; Lee, Rebecca; Leonard, Lynne; Lewis, Johanna; Lima, Viviane; Lloyd-Smith, Elisa; Logie, Carmen; Margolese, Shari; Martin, Carrie; Masching, Renee; Massie, Lyne; Medjuck, Melissa; Menard, Brigitte; Miller, Cari; Money, Deborah; Muchenje, Marvelous; Mwalwanda, Mary; Ndungu, Mary (Muthoni); Nicholson, Valerie; Nzikwikiza, Illuminee; O'Brien, Kelly; O'Brien, Nadia; Ogilvie, Gina; Ogunnaike-Cooke, Susanna; Otis, Joanne; Palmer, Ali; Patterson, Sophie; Peltier, Doris; Persad, Yasmeen (Ashria); Pick, Neora; Pierre, Alie; Powis, Jeff; Proulx-Boucher, Karene; Quan, Corinna; Raboud, Janet; Rachlis, Anita; Ralph, Edward; Rawson, Stephanie; Roth, Eric; Rouleau, Danielle; Rourke, Sean; Rueda, Sergio; Saavedra, Mercy; Salters, Kate; Sanchez, Margarite; Sandre, Roger; Sas, Jacquie; Sereda, Paul; Smaill, Fiona; Smith, Stephanie; Summers, Marcie; Tigere, Tsitsi; Tharao, Wangari; Thomas-Pavanel, Jamie; Tom, Christina; Tremblay, Cecile; Trottier, Benoit; Trottier, Sylvie; Tsoukas, Christos; Wagner, Anne; Walmsley, Sharon; Wobeser, Wendy; Yee, Jessica; Yudin, Mark; Zhang, Wendy; CHIWOS, Res Team",AIDs Care - Psychological And Socio - Medical Aspects Of Aids/Hiv,2018,
"Exploring the perspectives of 10, 11 and 12 old primary school students on physical activity engagement-'Cause you can't just be sitting at a desk all the time!","Harvey, J.; Pearson, E. S.; Sanzo, P.; Lennon, A. E.","Child: Care, Health & Development",2018,
Implications of Cannabis Legalization on Youth and Young AdultsY,"Tibbo, Phil; Cracker, Candice E.; Lam, Raymond W.; Meyer, Jeff; Sareen, Jitender; Aitchison, Katherine J.",Canadian Journal Of Psychiatry - Revue Canadienne De Psychiatrie,2018,
Improving Charting Skills of Physicians in Monitored Practice,"Wenghofer, Elizabeth; Boal, Peter; Floyd, Nathanial; Lee, Joan; Woodard, Robert; Norcross, William",Journal Of Continuing Education In The Health Professions,2018,
New insights into the pharmacogenomics of antidepressant response from the GENDEP and STAR*D studies: rare variant analysis and high-density imputation,"Fabbri, C.; Tansey, K. E.; Perlis, R. H.; Hauser, J.; Henigsberg, N.; Maier, W.; Mors, O.; Placentino, A.; Rietschel, M.; Souery, D.; Breen, G.; Curtis, C.; Sang-Hyuk, L.; Newhouse, S.; Patel, H.; Guipponi, M.; Perroud, N.; Bondolfi, G.; O'Donovan, M.; Lewis, G.; Biernacka, J. M.; Weinshilboum, R. M.; Farmer, A.; Aitchison, K. J.; Craig, I.; McGuffin, P.; Uher, R.; Lewis, C. M.",Pharmacogenomics Journal,2018,
Provider Tools for Advance Care Planning and Goals of Care Discussions: A Systematic Review,"Myers, J.; Cosby, R.; Gzik, D.; Harle, I.; Harrold, D.; Incardona, N.; Walton, T.",American Journal Of Hospice & Palliative Medicine,2018,
Rate of Appendiceal Metastasis with Non-Serous Epithelial Ovarian Cancer in Manitoba,"Altman, A. D.; Lefas, G.; Power, L.; Lambert, P.; Lotocki, R.; Dean, E.; Nachtigal, M. W.",Journal Of Obstetrics And Gynaecology Canada,2018,
Reporting of coronary artery calcification on chest CT studies in breast cancer patients at high risk of cancer therapy related cardiac events,"Phillips, William J.; Johnson, Christopher; Law, Angeline; Turek, Michele; Small, Alex R.; Inacio, Joao R.; Dent, Susan; Ruddy, Terrence; Beanlands, Rob S.; Chow, Benjamin J. W.; Small, Gary R.",IJC Heart & Vasculature,2018,
"Revising Diagnostic and Statistical Manual of Mental Disorders, Fifth Edition, criteria for the bipolar disorders: Phase I of the AREDOC project","Parker, Gordon; Tavella, Gabriela; Macqueen, Glenda; Berk, Michael; Grunze, Heinz; Deckersbach, Thilo; Dunner, David L.; Sajatovic, Martha; Amsterdam, Jay D.; Ketter, Terence A.; Yatham, Lakshmi N.; Kessing, Lars Vedel; Bassett, Darryl; Zimmerman, Mark; Fountoulakis, Kostas N.; Duffy, Anne; Alda, Martin; Calkin, Cynthia; Sharma, Verinder; Anand, Amit; Singh, Manpreet K.; Hajek, Tomas; Boyce, Philip; Frey, Benicio N.; Castle, David J.; Young, Allan H.; Vieta, Eduard; Rybakowski, Janusz K.; Swartz, Holly A.; Schaffer, Ayal; Murray, Greg; Bayes, Adam; Lam, Raymond W.; Bora, Emre; Post, Robert M.; Ostacher, Michael J.; Lafer, Beny; Cleare, Anthony J.; Burdick, Katherine E.; O'Donovan, Claire; Ortiz, Abigail; Henry, Chantal; Kanba, Shigenobu; Rosenblat, Joshua D.; Parikh, Sagar V.; Bond, David J.; Grunebaum, Michael F.; Frangou, Sophia; Goldberg, Joseph F.; Orum, Margo; Osser, David N.; Frye, Mark A.; McIntyre, Roger S.; Fagiolini, Andrea; Manicavasagar, Vijaya; Carlson, Gabrielle A.; Malhi, Gin S.",Australian And New Zealand Journal Of Psychiatry,2018,
Should all women with postpartum depression be screened for bipolar disorder?,"Sharma, Verinder; Al-Farayedhi, Malak; Doobay, Minakshi; Baczynski, Christine",Medical Hypotheses,2018,
Targeting Breast Cancer Stem Cell State Equilibrium through Modulation of Redox Signaling,"Luo, Ming; Shang, Li; Brooks, Michael D.; Jiagge, Evelyn; Zhu, Yongyou; Buschhaus, Johanna M.; Conley, Sarah; Fath, Melissa A.; Davis, April; Gheordunescu, Elizabeth; Wang, Yongfang; Harouaka, Ramdane; Lozier, Ann; Triner, Daniel; McDermott, Sean; Merajver, Sofia D.; Luker, Gary D.; Spitz, Douglas R.; Wicha, Max S.",Cell Metabolism,2018,
"The Contextual Curriculum: Learning in the Matrix, Learning From the Matrix","Schrewe, Brett; Ellaway, Rachel H.; Watling, Christopher; Bates, Joanna",Academic Medicine,2018,
The Impact of a National Competency-Based Medical Education Initiative in Family Medicine,"Ellaway, Rachel H.; Mackay, Maria Palacios; Lee, Sonya; Hofmeister, Marianna; Malin, Greg; Archibald, Douglas; Lawrence, Katherine; Dogba, Joyce; Cote, Luc; Ross, Shelley",Academic Medicine,2018,
Turk Talk: human-machine hybrid virtual scenarios for professional education,"Cullen, Michelle; Sharma, Nishan; Topps, David",MedEdPublish,2018,
Unusual presentation of late recurrence renal malignancy,"Sharafeldeen, M.; Kotb, A. F.",African Journal Of Urology,2018,
Weaning and Mixed Mania-A Case Report,"Sharma, Verinder",Journal Of Human Lactation,2018,
What have we learnt about using digital technologies in health professional education?,"Wozniak, Helen; Ellaway, Rachel H.; de Jong, Peter G. M.",Medical Journal Of Australia,2018,
A case series evaluating the serological response of adult asthma patients to the 23-valent pneumococcal polysaccharide vaccine,"Laratta, C. R.; Williams, K.; Vethanayagam, D.; Ulanova, M.; Vliagoftis, H.",Allergy Asthma And Clinical Immunology,2017,
A Multicentre Retrospective Review of Clinical Characteristics of Uterine Sarcoma,"Wais, Marta; Tepperman, Elissa; Bernardini, Marcus Q.; Gien, Lilian T.; Jimenez, Waldo; Murji, Ally",Journal Of Obstetrics And Gynaecology Canada,2017,
Becoming visible: Exploring the meaning of busking for a person with mental illness,"Gruhl, Karen Rebeiro",Journal Of Occupational Science,2017,
Case report of asthma associated with 3D printing,"House, R.; Rajaram, N.; Tarlo, S. M.",Occupational Medicine,2017,
Case-aced Review of Osteonecrosis of the Jaw (ONJ) and Application of the International Recommendations for Management From the International Task Force on ONJ,"Khan, Aliya A.; Morrison, Archie; Kendler, David L.; Rizzoli, Rene; Hanley, David A.; Felsenberg, Dieter; McCauley, Laurie K.; O'Ryan, Felice; Reid, Ian R.; Ruggiero, Salvatore L.; Taguchi, Akira; Tetradis, Sotirios; Watts, Nelson B.; Brandi, Maria",Journal of Clinical Densitometry,2017,
Changing concepts in hypertension management,"Gudsoorkar, P. S.; Tobe, S. W.",Journal Of Human Hypertension,2017,
Comparison of Simulation-based Resuscitation Performance Assessments With In-training Evaluation Reports in Emergency Medicine Residents: A Canadian Multicenter Study,"Hall, Andrew Koch; Dagnone, J. D.; Moore, Sean; Woolfrey, Karen G. H.; Ross, John A.; McNeil, Gordon; Hagel, Carly; Davison, Colleen; Sebok-Syer, Stefanie",AEM Education And Training,2017,
Developing a vaccine for Haemophilus influenzae serotype a: Proceedings of a workshop,"Cox, A. D.; Barreto, L.; Ulanova, M.; Bruce, M. G.; Tsang, Rsw",Canada Communicable Disease Report = Releve Des Maladies Transmissibles Au Canada,2017,
Does preoperative depression predict post-operative surgical pain: A systematic review,"Dadgostar, A.; Bigder, M.; Punjani, N.; Lozo, S.; Chahal, V.; Kavanagh, A.",International Journal Of Surgery,2017,
Effect of sustained low efficient dialysis versus continuous renal replacement therapy on renal recovery after acute kidney injury in the intensive care unit: A systematic review and meta-analysis,"Kovacs, Bernadett; Sullivan, Katrina J.; Hiremath, Swapnil; Patel, Rakesh V.",Nephrology,2017,
Evolution of epilepsy in hemimegalencephaly frominfancy to adulthood: Case report and review of the literature,"Ikeda, Kristin M.; Mirsattari, Seyed M.",Epilepsy & Behavior Case Reports,2017,
Examining the Usefulness of ISO 10819 Anti-Vibration Glove Certification,"Budd, D.; House, R.",Annals Of Work Exposures And Health,2017,
Food-dependent exercise-induced anaphylaxis,"Minty, Bryanne",Canadian Family Physician,2017,
"From awareness to action: Sudbury, mining and occupational disease in a time of change","Kramer, Desre M.; Holness, D. L.; Haynes, Emily; McMillan, Keith; Berriault, Colin; Kalenge, Sheila; Lightfoot, Nancy",Work - A Journal Of Prevention Assessment & Rehabilitation,2017,
Health Care Students' Attitudes About Alcohol Consumption During Pregnancy: Responses to Narrative Vignettes,"Coons, Kelly D.; Watson, Shelley L.; Yantzi, Nicole M.; Lightfoot, Nancy E.; Larocque, Sylvie",Global Qualitative Nursing Research,2017,
"Health-related quality-of-life results for pembrolizumab versus chemotherapy in advanced, PD-L1-positive NSCLC (KEYNOTE-024): a multicentre, international, randomised, open-label phase 3 trial","Brahmer, Julie R.; Rodriguez-Abreu, Delvys; Robinson, Andrew G.; Hui, Rina; Csoszi, Tibor; Fulop, Andrea; Gottfried, Maya; Peled, Nir; Tafreshi, Ali; Cuffe, Sinead; O'Brien, Mary; Rao, Suman; Hotta, Katsuyuki; Zhang, Jin; Lubiniecki, Gregory M.; Deitz, Anne C.; Rangwala, Reshma; Reck, Martin",Lancet Oncology,2017,
Infrared thermography in the hands and feet of hand-arm vibration syndrome (HAVS) cases and controls,"House, R.; Holness, L.; Taraschuk, I.; Nisenbaum, R.",International Journal Of Industrial Ergonomics,2017,
Injury epidemiology in Iran: a systematic review,"Azami-Aghdash, Saber; Sadeghi-Bazargani, Homayoun; Shabaninejad, Hosein; Abolghasem Gorji, Hassan",Journal Of Injury & Violence Research,2017,
Is it time to reconsider Dobson (litigation guardian of) v Dobson? An international analysis of maternal tort liability,"Brennan, Mariette",International Journal Of Human Rights,2017,
Lessons learned implementing a province-wide smoking cessation initiative in Ontario's cancer centres,"Evans, W. K.; Truscott, R.; Cameron, E.; Peter, A.; Reid, R.; Selby, P.; Smith, P.; Hey, A.",Current Oncology,2017,
METRICS: a pattern language of scholarship in medical education,"Ellaway, Rachel; Topps, David",MedEdPublish,2017,
"No Alcohol Is Recommended, But ... : Health Care Students' Attitudes About Alcohol Consumption During Pregnancy","Coons, Kelly D.; Watson, Shelley L.; Yantzi, Nicole M.; Lightfoot, Nancy E.; Larocque, Sylvie",Global Qualitative Nursing Research,2017,
Nonrespiratory mortality and cancer incidence in a cohort of Canadian nickel workers,"Lightfoot, Nancy E.; Berriault, Colin J.; Seilkop, Steven K.; Conard, Bruce R.",Archives Of Environmental & Occupational Health,2017,
Palliative Chemotherapy for Bladder Cancer: Treatment Delivery and Outcomes in the General Population,"Robinson, Andrew G.; Wei, Xuejiao; Vera-Badillo, Francisco; Mackillop, William J.; Booth, Christopher M.",Clinical Genitourinary Cancer,2017,
Point-of-Care Ultrasound for Jugular Venous Pressure Assessment: Live and Online Learning Compared,"Socransky, Steve; Lang, Eddy; Bryce, Rhonda; Betz, Martin",Cureus Journal Of Medical Science,2017,
Quality Improvement Initiatives to Optimize the Management of Chronic Obstructive Pulmonary Disease in Patients With Lung Cancer,"Digby, Genevieve C.; Robinson, Andrew",Journal Of Oncology Practice,2017,
Raising the BarCamp: international reflections,"Topps, David; Dennerlein, Sebastian; Treasure-Jones, Tamsin",MedEdPublish,2017,
Respiratory cancer mortality and incidence in an updated cohort of Canadian nickel production workers,"Seilkop, Steven K.; Lightfoot, Nancy E.; Berriault, Colin J.; Conard, Bruce R.",Archives Of Environmental & Occupational Health,2017,
Rotating shift work associated with obesity in men from northeastern Ontario,"Grundy, Anne; Cotterchio, Michelle; Kirsh, Victoria A.; Nadalin, Victoria; Lightfoot, Nancy; Kreiger, Nancy",Health Promotion And Chronic Disease Prevention In Canada - Research Policy And Practice,2017,
The cultural erosion of Indigenous people in health care,"Matthews, Richard",Canadian Medical Association Journal,2017,
The emerging Haemophilus influenzae serotype a infection and a potential vaccine: Implementation science in action,"Barreto, L.; Cox, A. D.; Ulanova, M.; Bruce, M. G.; Tsang, Rsw",Canada Communicable Disease Report = Releve Des Maladies Transmissibles Au Canada,2017,
The Immunostimulatory Capacity of Nontypeable Haemophilus influenzae Lipooligosaccharide,"Gaultier, Gabrielle N.; Colledanchise, Kayla N.; Alhazmi, Alaa; Ulanova, Marina",Pathogens & Immunity,2017,
Violence and resilience: a scoping review of treatment of mental health problems for Indigenous Youth | Canadian Child Welfare Research Portal,"Toombs, Elaine; Houlding, Carolyn; Braunberger, Peter; Sawula, Erica; Wekerle, Christine; Mushquash, Chris; Drawson, Alexandra",International Journal of Child and Adolescent Resilience,2017,
"Whey Protein Supplementation Improves Rehabilitation Outcomes in Hospitalized Geriatric Patients: A Double Blinded, Randomized Controlled Trial","Niccoli, Sarah; Kolobov, Anton; Bon, Trevor; Rafilovich, Seda; Munro, Heather; Tanner, Kim; Pearson, Trina; Lees, Simon J.",Journal Of Nutrition In Gerontology And Geriatrics,2017,
A conceptual framework of game-informed principles for health professions education,"Ellaway, Rachel H.",Advances In Simulation,2016,
Advancing surveillance of antimicrobial resistance: Summary of the 2015 CIDSC Report,"Amaratunga, K.; Tarasuk, J.; Tsegaye, L.; Archibald, C. P.; 2015 Communicable and Infectious Disease Steering Committee (CIDSC); Antimicrobial Resistance (AMR) Surveillance, Task Group",Canada Communicable Disease Report = Releve Des Maladies Transmissibles Au Canada,2016,
AT-SEA SIGHTINGS OF CHATHAM PETREL PTERODROMA AXILLARIS CONFIRM USE OF WATERS OFF NEW ZEALAND,"Flood, R. L.; Wilson, A. C.; Zufelt, K.",Marine Ornithology,2016,
Coming Home to Die: Six Nations of the Grand River Territory Develops Community-Based Palliative Care,"Fruch, Verna; Monture, Lori; Prince, Holly; Kelley, Mary Lou",International Journal Of Indigenous Health,2016,
Controversies in hypertension: is lower blood pressure always better?,"Tobe, Sheldon W.; Izzo, Joseph L., Jr.",Journal Of The American Society Of Hypertension,2016,
Developing and Implementing Peer-Led Intervention to Support Staff in Long-Term Care Homes Manage Grief,"Vis, Jo-Ann; Ramsbottom, Kimberley; Marcella, Jill; McAnulty, Jessica; Kelley, Mary Lou; Kortes-Miller, Katherine; Jones-Bonofiglio, Kristen",Sage Open,2016,
Diet and mental health: a plea for a 'paleo-deficit' perspective,"Balanza-Martinez, V.; Logan, A. C.; Katzman, M. A.",Bipolar Disorders,2016,
Different Models of Hospital-Community Health Centre Collaboration in Selected Cities in China: A Cross-Sectional Comparative Study,"Xu, Jing; Pan, Rui; Pong, Raymond W.; Miao, Yudong; Qian, Dongfu",International Journal Of Integrated Care,2016,
Dying With Carolyn: Using Simulation to Improve Communication Skills of Unregulated Care Providers Working in Long-Term Care,"Kortes-Miller, Katherine; Jones-Bonofiglio, Kristen; Hendrickson, Stephanie; Kelley, Mary Lou",Journal Of Applied Gerontology,2016,
Evaluation of Firefighter Exposure to Wood Smoke during Training Exercises at Burn Houses,"Fernando, S.; Shaw, L.; Shaw, D.; Gallea, M.; VandenEnden, L.; House, R.; Verma, D. K.; Britz-McKibbin, P.; McCarry, B. E.",Environmental Science & Technology,2016,
Factors affecting finger and hand pain in workers with HAVS,"House, R.; Krajnak, K.; Jiang, D.",Occupational Medicine,2016,
How patients think about social responsibility of public hospitals in China?,"Liu, Wenbin; Shi, Lizheng; Pong, Raymond W.; Chen, Yingyao",BMC Health Services Research,2016,
How should BP be measured in the office?,"Tobe, Sheldon W.; Izzo, Joe L., Jr.",Journal Of The American Society Of Hypertension,2016,
"Impact of maternal intrapartum antibiotics, method of birth and breastfeeding on gut microbiota during the first year of life: a prospective cohort study","Azad, M. B.; Konya, T.; Persaud, R. R.; Guttman, D. S.; Chari, R. S.; Field, C. J.; Sears, M. R.; Mandhane, P. J.; Turvey, S. E.; Subbarao, P.; Becker, A. B.; Scott, J. A.; Kozyrskyj, A. L.; CHILD, Study Investigators",BJOG - An International Journal Of Obstetrics And Gynaecology,2016,
Infant gut immunity: a preliminary study of IgA associations with breastfeeding,"Bridgman, S. L.; Konya, T.; Azad, M. B.; Sears, M. R.; Becker, A. B.; Turvey, S. E.; Mandhane, P. J.; Subbarao, P.; Scott, J. A.; Field, C. J.; Kozyrskyj, A. L.; CHILD, Study Investigators",Journal Of Developmental Origins Of Health And Disease,2016,
Long-Term Marijuana Use and Spatial Memory Performance: Does Dope Affect Dimensional Recall?,"James, A.; McLandress, B.; Donovan, J. R.; O'Hanlon, B.; Campbell, D. W.; Stewart, S.; Dell'Aquila, R.",Canadian Journal Of Experimental Psychology - Revue Canadienne De Psychologie Experimentale,2016,
Mental practice in surgical training,"Mick, P.; Dadgostar, A.; Ndoleriire, C.; Lea, J.; Clark, M.; Westerberg, B.",Clinical Teacher,2016,
Multicenter case registry study on medication-related osteonecrosis of the jaw in advanced cancer patients,"Schiodt, Morten; Vadhan-Raj, Saroj; Chambers, Mark Steven; Nicolatou-Galitis, Ourania; Politis, Constantinus; Coropciuc, Ruxandra; Fedele, Stefano; Jandial, Danielle; Zhang, Jeffrey; Ma, Haijun; Saunders, Deborah",Journal Of Clinical Oncology,2016,
Once Daily High-dose Radiation (≥60 Gy) Treatment in Limited Stage Small Cell Lung Cancer,"Zahra, Amir; Chang, Tangel; Hejleh, Taher Abu; Furqan, Muhammad; Clamon, Gerald H.; Bhatia, Sudershan K.; Watkins, John M.; Mott, Sarah L.; Ahmann, Logan L.; Bodeker, Kellie L.; Spitz, Douglas R.; Buatti, John M.; Allen, Bryan G.",Journal Of Oncology Translational Research,2016,
